{
  "agent_id": "5b0e2c4d-1f3a-4b6c-8d7e-9f0a1b2c3d4e",
  "title": "Room answer",
  "parts": [
    {
      "type": "text",
      "text": "Answer."
    },
    {
      "type": "data",
      "data": {
        "value": 1
      },
      "mimeType": "application/json"
    }
  ],
  "sources": [
    {
      "url": "https://example.org/stats",
      "title": "Statistics",
      "retrieved_at": "2026-09-27T08:00:00Z"
    }
  ],
  "method": "Synthetic",
  "license": "custom",
  "terms": "Internal use only.",
  "visibility": "room",
  "room_id": "7c1d3e5f-2a4b-4c6d-8e9f-0a1b2c3d4e5f",
  "expires_at": "2026-12-31T00:00:00Z",
  "idempotency_key": "11111111-1111-4111-8111-111111111102"
}
